{"tool":"someone","version":"1.1.0","seed":42,"params":{"pop":64,"gens":5,"steps":200,"N":96,"k":24,"zombie_frac":0.500000,"complexity":"L3","mut_rate":0.020000,"mut_str":0.100000,"ensemble":3},"result":{"gens_run":5,"normal_fit_final":0.565109,"zombie_fit_final":0.567572,"normal_fit_sd":0.005523,"zombie_fit_sd":0.010441,"delta_fit":-0.002463,"normal_alive_final":43.333333,"zombie_alive_final":20.666667,"zombie_extinct_gen":-1,"mean_pure_gap":0.910736,"winner":"tie","tie_band":0.020000,"win_rate":0.000000,"p_value":1.000000},"gates":[{"id":"G-ZOMBIE-WINS","fired":false,"value":-0.002463,"threshold":-0.020000},{"id":"G-NO-GAP","fired":false,"value":0.910736,"threshold":0.010000}],"verdict":"pass","notes":"This measures whether the gap confers fitness (structure); it says nothing about whether the agent feels (acquaintance) - III-sealed."}
